{
  "schema_version": "tessera/makepad-evidence-matrix/v1",
  "runner_version": "makepad-evidence-runner/0.1.0",
  "fixtures": [
    {"fixture_id": "shell-basic", "relative_path": "fixtures/shell-basic.json", "sha256": "bd77b034f0f4051edc6676f75653f12fdfdf0881640619371f86929e676ee9bd"},
    {"fixture_id": "keyboard-focus", "relative_path": "fixtures/keyboard-focus.json", "sha256": "5c7f0e1ffa0af3c332065a18522e631eaaae5dbf65c15cd02fcec40ee0fef6ca"},
    {"fixture_id": "cjk-ime", "relative_path": "fixtures/cjk-ime.json", "sha256": "4fe0d13bdd9813b969f8a9acdde7b88487c5fe83c7c4bc75645d9fc23dd82c56"},
    {"fixture_id": "overlay-focus", "relative_path": "fixtures/overlay-focus.json", "sha256": "9379d00d440be2b1cc564f8516ca804c093ee0c6233316096465146da4954148"},
    {"fixture_id": "ax-bridge", "relative_path": "fixtures/ax-bridge.json", "sha256": "aea9c52670a1c160e909729930913c1bd9d569aa08c71792abbe9125f5d6ad1a"},
    {"fixture_id": "mobile-install", "relative_path": "fixtures/mobile-install.json", "sha256": "80f35e3d30dee77d1a05ce2803a15d194922fb31d6518df95904a3aaa542f716"},
    {"fixture_id": "linechart-10k", "relative_path": "fixtures/linechart-10k.json", "sha256": "b1fd8ecd72a1c8a47da38bc429e02749b9e2af6f0ccb282559be121dd64c70b8"},
    {"fixture_id": "datagrid-10k", "relative_path": "fixtures/datagrid-10k.json", "sha256": "82873ba342e4546e8e1d75e741ab3a47ea88305f625172ae9dfa11704251035f"},
    {"fixture_id": "long-document", "relative_path": "fixtures/long-document.json", "sha256": "c01c9e4f9fb8fb39e134caf5d72f5af7dc8cf0de7da14a3c6cb2829274741765"},
    {"fixture_id": "motion-idle", "relative_path": "fixtures/motion-idle.json", "sha256": "c893689659c79295ed43c73314c07030201e33367f4633d959e54c782673c7be"},
    {"fixture_id": "button-checkbox", "relative_path": "fixtures/button-checkbox.json", "sha256": "7d57d05b2b97314b675258c74c61b2f4e9a3b61510e9c77a770e193b79232ede"},
    {"fixture_id": "markdown-reject", "relative_path": "fixtures/markdown-reject.json", "sha256": "f077576fba5f35c676ce9c6e4b783a36e5d9873903c1874b3a86f0ae2e1d0d1f"},
    {"fixture_id": "mermaid-cubic3", "relative_path": "fixtures/mermaid-cubic3.json", "sha256": "1e189b2e8213af5413c18409139c6234a1a6bf706568ad09a74f925571b7d38d"}
  ],
  "cells": [
    {
      "cell_id": "MAKEPAD-M0-SHELL-DESKTOP-LIGHT",
      "case_id": "SHELL",
      "fixture_id": "shell-basic",
      "platform": "macos",
      "device": "macos-arm64-windowserver",
      "theme": "light",
      "viewport": "1280x800",
      "system_scale": "100%",
      "app_scale": "100%",
      "content_profile": "shell-basic",
      "input_profile": "keyboard-focus",
      "lifecycle_profile": "launch-idle",
      "ordinal": 0,
      "requires": ["real_gui", "focus", "motion_idle"],
      "artifacts": [
        {"artifact_id": "binary", "relative_path": "artifacts/binary.bin", "kind": "binary", "required": true, "synthetic_allowed": false, "binding": "binary"},
        {"artifact_id": "screenshot", "relative_path": "artifacts/screenshot.png", "kind": "screenshot", "required": true, "synthetic_allowed": false},
        {"artifact_id": "geometry", "relative_path": "artifacts/geometry.json", "kind": "geometry", "required": true, "synthetic_allowed": false},
        {"artifact_id": "input-trace", "relative_path": "artifacts/input-trace.json", "kind": "input_trace", "required": true, "synthetic_allowed": false},
        {"artifact_id": "ax-tree", "relative_path": "artifacts/ax-tree.json", "kind": "ax_tree", "required": true, "synthetic_allowed": false},
        {"artifact_id": "performance", "relative_path": "artifacts/performance.json", "kind": "performance", "required": true, "synthetic_allowed": false},
        {"artifact_id": "manual-review", "relative_path": "artifacts/manual-review.json", "kind": "manual_review", "required": true, "synthetic_allowed": false}
      ]
    },
    {
      "cell_id": "MAKEPAD-M0-SHELL-DESKTOP-DARK-SCALE125",
      "case_id": "SHELL",
      "fixture_id": "shell-basic",
      "platform": "macos",
      "device": "macos-arm64-windowserver",
      "theme": "dark",
      "viewport": "1024x768",
      "system_scale": "125%",
      "app_scale": "100%",
      "content_profile": "shell-basic",
      "input_profile": "keyboard-focus",
      "lifecycle_profile": "launch-idle",
      "ordinal": 0,
      "requires": ["real_gui", "focus", "system_scale"],
      "artifacts": [
        {"artifact_id": "binary", "relative_path": "artifacts/binary.bin", "kind": "binary", "required": true, "synthetic_allowed": false, "binding": "binary"},
        {"artifact_id": "screenshot", "relative_path": "artifacts/screenshot.png", "kind": "screenshot", "required": true, "synthetic_allowed": false},
        {"artifact_id": "geometry", "relative_path": "artifacts/geometry.json", "kind": "geometry", "required": true, "synthetic_allowed": false},
        {"artifact_id": "input-trace", "relative_path": "artifacts/input-trace.json", "kind": "input_trace", "required": true, "synthetic_allowed": false},
        {"artifact_id": "ax-tree", "relative_path": "artifacts/ax-tree.json", "kind": "ax_tree", "required": true, "synthetic_allowed": false},
        {"artifact_id": "performance", "relative_path": "artifacts/performance.json", "kind": "performance", "required": true, "synthetic_allowed": false},
        {"artifact_id": "manual-review", "relative_path": "artifacts/manual-review.json", "kind": "manual_review", "required": true, "synthetic_allowed": false}
      ]
    },
    {
      "cell_id": "MAKEPAD-M0-TEXTINPUT-CJK-IME-DESKTOP",
      "case_id": "TEXTINPUT-CJK-IME",
      "fixture_id": "cjk-ime",
      "platform": "macos",
      "device": "macos-arm64-windowserver",
      "theme": "light",
      "viewport": "1280x800",
      "system_scale": "100%",
      "app_scale": "100%",
      "content_profile": "cjk-composition",
      "input_profile": "keyboard-ime",
      "lifecycle_profile": "launch-compose-commit-undo",
      "ordinal": 0,
      "requires": ["real_gui", "keyboard", "ime", "focus", "ax"],
      "artifacts": [
        {"artifact_id": "binary", "relative_path": "artifacts/binary.bin", "kind": "binary", "required": true, "synthetic_allowed": false, "binding": "binary"},
        {"artifact_id": "screenshot", "relative_path": "artifacts/screenshot.png", "kind": "screenshot", "required": true, "synthetic_allowed": false},
        {"artifact_id": "geometry", "relative_path": "artifacts/geometry.json", "kind": "geometry", "required": true, "synthetic_allowed": false},
        {"artifact_id": "ime-trace", "relative_path": "artifacts/ime-trace.json", "kind": "ime_trace", "required": true, "synthetic_allowed": false},
        {"artifact_id": "ax-tree", "relative_path": "artifacts/ax-tree.json", "kind": "ax_tree", "required": true, "synthetic_allowed": false},
        {"artifact_id": "manual-review", "relative_path": "artifacts/manual-review.json", "kind": "manual_review", "required": true, "synthetic_allowed": false}
      ]
    },
    {
      "cell_id": "MAKEPAD-M0-MODAL-POPOVER-DESKTOP",
      "case_id": "MODAL-POPOVER",
      "fixture_id": "overlay-focus",
      "platform": "macos",
      "device": "macos-arm64-windowserver",
      "theme": "dark",
      "viewport": "1024x768",
      "system_scale": "100%",
      "app_scale": "125%",
      "content_profile": "modal-popover",
      "input_profile": "keyboard-focus",
      "lifecycle_profile": "open-tab-escape-return",
      "ordinal": 0,
      "requires": ["real_gui", "keyboard", "focus_trap", "overlay_geometry", "ax"],
      "artifacts": [
        {"artifact_id": "binary", "relative_path": "artifacts/binary.bin", "kind": "binary", "required": true, "synthetic_allowed": false, "binding": "binary"},
        {"artifact_id": "screenshot", "relative_path": "artifacts/screenshot.png", "kind": "screenshot", "required": true, "synthetic_allowed": false},
        {"artifact_id": "geometry", "relative_path": "artifacts/geometry.json", "kind": "geometry", "required": true, "synthetic_allowed": false},
        {"artifact_id": "input-trace", "relative_path": "artifacts/input-trace.json", "kind": "input_trace", "required": true, "synthetic_allowed": false},
        {"artifact_id": "overlay-trace", "relative_path": "artifacts/overlay-trace.json", "kind": "overlay_trace", "required": true, "synthetic_allowed": false},
        {"artifact_id": "ax-tree", "relative_path": "artifacts/ax-tree.json", "kind": "ax_tree", "required": true, "synthetic_allowed": false},
        {"artifact_id": "manual-review", "relative_path": "artifacts/manual-review.json", "kind": "manual_review", "required": true, "synthetic_allowed": false}
      ]
    },
    {
      "cell_id": "MAKEPAD-M0-AX-BRIDGE-DESKTOP",
      "case_id": "AX-BRIDGE",
      "fixture_id": "ax-bridge",
      "platform": "macos",
      "device": "macos-arm64-voiceover",
      "theme": "light",
      "viewport": "1280x800",
      "system_scale": "100%",
      "app_scale": "100%",
      "content_profile": "accessibility-tree",
      "input_profile": "assistive-technology-actions",
      "lifecycle_profile": "initial-update-removal-roundtrip",
      "ordinal": 0,
      "requires": ["real_gui", "ax_tree", "voiceover", "ax_action_roundtrip"],
      "artifacts": [
        {"artifact_id": "binary", "relative_path": "artifacts/binary.bin", "kind": "binary", "required": true, "synthetic_allowed": false, "binding": "binary"},
        {"artifact_id": "screenshot", "relative_path": "artifacts/screenshot.png", "kind": "screenshot", "required": true, "synthetic_allowed": false},
        {"artifact_id": "geometry", "relative_path": "artifacts/geometry.json", "kind": "geometry", "required": true, "synthetic_allowed": false},
        {"artifact_id": "ax-tree", "relative_path": "artifacts/ax-tree.json", "kind": "ax_tree", "required": true, "synthetic_allowed": false},
        {"artifact_id": "ax-actions", "relative_path": "artifacts/ax-actions.json", "kind": "ax_action_trace", "required": true, "synthetic_allowed": false},